B0B42RSQWR,https://www.amazon.in/Acer-Generation-Windows-A315-59-15-6-inch/dp/B0B42RSQWR/ref=sr_1_43?dib=eyJ2IjoiMSJ9.et336k7YhQuRNJQqOUP0bz50Fs6EZ8AqsdCOjCxg5VBNyfd3scVlUyd-J5manTr1QCjr0F2XA6mF_shNFi6Cvd7pZCyzNQa7KXWA0tQjHwSQMhb9DVboIjTooPhWDmcaGLAj0ovBaYFvFAxjN1XIQQIZPxAyH86jdLYQZTiXpqk6fB04z_XowHw_wam3hlyXbDvJMaucuC5vtB4ZWYMIF5K3BL85zb_hFoFoOqbHRjM47Nklm3E_bK4_NF6vxkN6TIW_fWRPsFIr9BqREJfopf3b0BE6JmdwCbmPA6n5EA0.g0PpJH1ZPjjvjl3-1zamPLZBit6xir_CyDMvY-ubwmk&dib_tag=se&qid=1721801975&refinements=p_89%3AAcer&rnid=3837712031&s=computers&sr=1-43,Acer Aspire 3 Thin and Light Laptop Intel Core i5 12th Generation (8GB/512 GB SSD/Windows 11 Home/MS Office/1.7 Kg/Silver) A315-59 with 15.6-inch (39.6 cms) Full HD Display,3.7,21.0,," Powerful Productivity: 12th Generation Intel Core i5-1235U processor delivers unmatched speed and intelligence, from streaming to browsing to photo and video editing and more — experience the performance boost you need for your biggest breakthroughs. (10 cores, 3.30 GHz speed, 12MB Intel Smart Cache);Internal Specifications: 8GB DDR4 memory; 512GB NVMe SSD to store your files and media |  Positively Productive : Be positively productive with Windows 11, featuring new animations, buttons, and toggles. Quickly organize open apps with Snap Layouts and enjoy seamless integration with Outlook and Calendar. Perfect for work, study, and play |  The Display : The 1080p Full HD display is perfect for casual web browsing and watching movies or streaming, allowing for a sharp, detailed view of what’s in front of you. And with Acer BlueLightShield, lower the levels of blue light to lessen the negative effects of blue light exposure. 15.6"" FHD 1920 x 1080, high-brightness Acer ComfyViewTM LED-backlit TFT LCD |  Elevated Design, Acer TNR Solution, Narrow Bezel, 1.78 Kg; Stay Connected : Stay connected to friends and family with a 720p HD webcam. Featuring Acer TNR (Temporal Noise Reduction) Solution for better video calling in low-light conditions and dual speakers with full, high-quality sound. |  Software Included: Microsoft Office 365; Form Factor: Netbook; Resolution: 1080p1280 X 720 |  Powerful Productivity: 12th Generation Intel Core i5-1235U processor delivers unmatched speed and intelligence, from streaming to browsing to photo and video editing and more experience the performance boost you need for your biggest breakthroughs. (10 cores, 3.30 GHz speed, 12MB Intel Smart Cache);Internal Specifications: 8GB DDR4 memory; 512GB NVMe SSD to store your files and media |  Positively Productive : Be positively productive with Windows 11, featuring new animations, buttons, and toggles. Quickly organize open apps with Snap Layouts and enjoy seamless integration with Outlook and Calendar. Perfect for work, study, and play | The Display : The 1080p Full HD display is perfect for casual web browsing and watching movies or streaming, allowing for a sharp, detailed view of what s in front of you. And with Acer BlueLightShield, lower the levels of blue light to lessen the negative effects of blue light exposure. 15.6"" FHD 1920 x 1080, high-brightness Acer ComfyViewTM LED-backlit TFT LCD | Elevated Design, Acer TNR Solution, Narrow Bezel, 1.78 Kg; Stay Connected : Stay connected to friends and family with a 720p HD webcam. Featuring Acer TNR (Temporal Noise Reduction) Solution for better video calling in low-light conditions and dual speakers with full, high-quality sound.; Software Included: Microsoft Office 365; Form Factor: Netbook; Resolution: 1080p1280 X 720 | Battery Average Life: 0.0 Hours",https://www.amazon.in/dp/B0B42RSQWR,43990,https://m.media-amazon.com/images/I/91yXhj4zw5L._SL1500_.jpg,11,"""https://m.media-amazon.com/images/I/91yXhj4zw5L._SL1500_.jpg | https://m.media-amazon.com/images/I/71TADvIqdyL._SL1500_.jpg | https://m.media-amazon.com/images/I/813RmE4c6SL._SL1500_.jpg | https://m.media-amazon.com/images/I/71XOWuvmWTL._SL1500_.jpg | https://m.media-amazon.com/images/I/81YrGcdkWCL._SL1500_.jpg | https://m.media-amazon.com/images/I/81trMdWB6qL._SL1500_.jpg | https://m.media-amazon.com/images/I/81N4TQI9a2L._SL1500_.jpg | https://m.media-amazon.com/images/I/518vloXYC3L._SL1500_.jpg | https://m.media-amazon.com/images/I/61z+eQGOS4L._SL1500_.jpg | https://m.media-amazon.com/images/I/61V7p517-OL._SL1500_.jpg | https://m.media-amazon.com/images/I/518vloXYC3L._SL1500_.jpg""","Acer Aspire 3 Intel Core i5-1235U Processor Laptop  (Windows 11 Home/ 8 GB/ 512 GB SSD) A324-51 with 35.56 cm (14"") Full HD IPS Display, Backlit Keyboard, Steel Gray, 1.45 KG",https://store.acer.com/en-in/acer-aspire-3-intel-core-i5-1235u-processor-laptop-windows-11-home-8-gb-512-gb-ssd-a324-51-with-35-56-cm-14-full-hd-ips-display-backlit-keyboard-steel-gray-1-45-kg-un-343si-009,LED,45.6 Wh,Lithium Ion (Li-Ion),Yes,Supports Bluetooth 5.2,Steel Gray,20.66 cm,IPS (In-Plane Switching) technology,"35.6 cm (14"") IPS Display with Full HD 1920 x 1080, LED-backlit TFT LCD, 16:9 aspect ratio, 45% NTSC color gamut, Wide viewing angle up to 170 degrees, Ultra-slim design, Mercury free, environment friendly",,,"E-mail: ail.easycare@acer.com Contact number：1800-11-6677 (For Laptop & Tablet), 1800-11-4100 ( For Desktop, Monitor & All in One ) Support Timings – 9:00 AM to 6:00 PM ( Monday to Saturday, except public holidays )",E-mail: acerindia.enquiries@acer.com Contact number: 1860-120-2019,Intel®,Intel Integrated Graphics,,Yes,,1.94 cm,,Yes,84-key Acer keyboard layout with US language,Tech Front Chongqing Computer Co Ltd 18 ZONGBAO ROAD SHAPINGBA DISTRICT Chongqing China 401332,ACER INDIA PRIVATE LIMITED Embassy Heights 6th Floor No 13 Magrath Road Next to HOSMAT HospitalBangaloreINDIA 560025,Upgradable to 64 GB using two SO-DIMM modules,DDR4 SDRAM,Yes,,2.0,,2,,Windows 11 Home,64-bit,,"1U (contains Laptop 1N, Power cord 1N, Adapter 1N, User Manual 1N)",Multi-gesture Touchpad,3-pin 65W PD adapter,,Intel Core i5-1235U,,,Core™ i5,,"35.6 cm (14"")",,"512 GB, PCIe Gen4.0x 4, NVMe, Support up to 1 TB",Stereo,Yes,8 GB,"2 x USB 3.2 Port, 1 x USB 2.0 Port, 1 x USB Type-C Port, 1 x Type-c Port for PD Adapter",512 GB,Yes,One-year Warranty,Yes,2M With Privacy Camera Shutter,1.45 KG,32.17 cm,Yes,,,IEEE 802.11 a/b/g/n+ac+ax,,,,,,,,,,,,,,,,,Acer Aspire 3
B0BWNJS81C,https://www.amazon.in/Acer-Hexa-Core-Processor-Graphics-AN515-47/dp/B0BWNJS81C/ref=sr_1_44?dib=eyJ2IjoiMSJ9.et336k7YhQuRNJQqOUP0bz50Fs6EZ8AqsdCOjCxg5VBNyfd3scVlUyd-J5manTr1QCjr0F2XA6mF_shNFi6Cvd7pZCyzNQa7KXWA0tQjHwSQMhb9DVboIjTooPhWDmcaGLAj0ovBaYFvFAxjN1XIQQIZPxAyH86jdLYQZTiXpqk6fB04z_XowHw_wam3hlyXbDvJMaucuC5vtB4ZWYMIF5K3BL85zb_hFoFoOqbHRjM47Nklm3E_bK4_NF6vxkN6TIW_fWRPsFIr9BqREJfopf3b0BE6JmdwCbmPA6n5EA0.g0PpJH1ZPjjvjl3-1zamPLZBit6xir_CyDMvY-ubwmk&dib_tag=se&qid=1721801975&refinements=p_89%3AAcer&rnid=3837712031&s=computers&sr=1-44,Acer Nitro 5 Gaming Laptop AMD Ryzen™ 5 7535HS Hexa-Core Processor- (8GB/ 512 GB SSD/NVIDIA GeForce RTX 3050 4GB Graphics/Windows 11 Home) AN515-47 with 39.6 Cm (15.6 Inch) IPS Display,4.2,135.0,," Latest High Speed Gaming Performance : Encounter high speed processing with the latest AMD Ryzen5 7535HS Hexa-Core Processor that ensure smooth gaming experience |  Internal Specifications: Dual-channel DDR5 SDRAM support: 8 GB of DDR5 system memory, Upgradable up to 32GB system memory (Memory Frequency: up to 4800 MT/s); Powerful Graphics: NVIDIA GeForce RTX 3050 with 4 GB of dedicated GDDR6 VRAM |  Display: 15.6"" display with IPS (In-Plane Switching) technology, Full HD 1920 x 1080, Acer ComfyView LED-backlit TFT LCD, 16:9 aspect ratio, supporting 144 Hz refresh rate, Wide viewing angle up to 170 degrees, Ultra-slim design, Mercury free, environment friendly |  Other Features: AMD FreeSync Premium, Nitro Sense, Killer E2600Wi-Fi 6E, Gen 4 SSD |  Battery Average Life: 10 hours",https://www.amazon.in/dp/B0BWNJS81C,66104,https://m.media-amazon.com/images/I/81gQvl-qT8L._SL1500_.jpg,12,"""https://m.media-amazon.com/images/I/81gQvl-qT8L._SL1500_.jpg | https://m.media-amazon.com/images/I/71AiqDEyC0L._SL1500_.jpg | https://m.media-amazon.com/images/I/810Z8+F03tL._SL1500_.jpg | https://m.media-amazon.com/images/I/71pTyKwXOrL._SL1500_.jpg | https://m.media-amazon.com/images/I/71lliaj28CL._SL1500_.jpg | https://m.media-amazon.com/images/I/81Bxi1csxUL._SL1500_.jpg | https://m.media-amazon.com/images/I/81NIB0S9+0L._SL1500_.jpg | https://m.media-amazon.com/images/I/71GqaUpJjTL._SL1500_.jpg | https://m.media-amazon.com/images/I/81TP+R7KrxL._SL1500_.jpg | https://m.media-amazon.com/images/I/81NKnRK+9ML._SL1500_.jpg | https://m.media-amazon.com/images/I/71Dt4wYM4lL._SL1500_.jpg | https://m.media-amazon.com/images/I/81DV76QUQyL._SL1500_.jpg""","Acer Nitro V Gaming Laptop AMD Ryzen 5-7535HS Processor (Windows 11 Home/ 8 GB/ 512 GB SSD/ NVIDIA GeForce RTX 3050/ 144Hz) ANV15-41 with FHD 39.62 cm (15.6"") IPS Display, Obsidian Black, 2.1 KG",https://store.acer.com/en-in/acer-nitro-v-gaming-laptop-amd-ryzen-5-7535hs-processor-windows-11-home-8-gb-512-gb-ssd-nvidia-geforce-rtx-3050-144hz-anv15-41-with-fhd-39-62-cm-15-6-ips-display-obsidian-black-2-1-kg-nh-qpfsi-001,,57 Wh,Lithium Ion (Li-Ion),Yes,Supports Bluetooth 5.1,Obsidian Black,23.98 cm,IPS (In-Plane Switching) Technology,"39.6 cm (15.6"") IPS Display with Full HD 1920 x 1080, Acer ComfyView LED-backlit TFT LCD, 16:9 aspect ratio, supporting 144 Hz refresh rate, Wide viewing angle up to 170 degrees, Ultra-slim design, Mercury free, environment friendly",Gigabit Ethernet,,"E-mail: ail.easycare@acer.com Contact number：1800-11-6677 (For Laptop & Tablet), 1800-11-4100 ( For Desktop, Monitor & All in One ) Support Timings – 9:00 AM to 6:00 PM ( Monday to Saturday, except public holidays",E-mail: acerindia.enquiries@acer.com Contact number: 1860-120-2019,NVIDIA®️,NVIDIA GeForce RTX 3050,,Yes,,2.35 cm,,Yes,"99-/100-/103-key Acer backlit keyboard with international language support, with indicators of CapsLock and F4/Microphone mute","Compal Electronics Pvt Ltd, No.D01, Zone D, Air Port Section of LiangLu CunTan Free Trade Port Area, YuBei District, Chongqing, China","ACER INDIA PRIVATE LIMITED Embassy Heights, 6th Floor, No. 13, Magrath Road, Next to HOSMAT Hospital, Bangalore, INDIA – 56002",Up to 32 GB,DDR 5,Yes,Yes,4.0,1.0,,,Windows 11 Home,64-bit,DTS X: Ultra Audio,"1U (contains Laptop 1N, Power cord 1N, Adapter 1N, User Manual 1N)","Multi-gesture secure touchpad, supporting two-finger scroll; pinch; gestures to open Cortana, Action Center, multitasking ; application commands",3-pin 135 W AC adapter,,AMD Ryzen 5-7535HS Hexa-Core Processor,,,Ryzen™ 5,,"39.6 cm (15.6"")",,"512 GB PCIe Gen4, 16 Gb/s, NVMe, (Upgradable upto 2*1 TB)",,Yes,8 GB,"1 x USB 3.2 Gen 1 port with power-off charging, 2 x USB 3.2 Gen 1 port, 1 x USB 4 port",512 GB,Yes,One-year International Travelers Warranty (ITW),Yes,UFC with T-Type HD camera with 1280 x 720 resolution and 720p HD video at 30 fps with Temporal Noise Reduction,2.1 KG,36.23 cm,Yes,,,IEEE 802.11 a/b/g/n+ac+ax,,,,Dedicated,6 GB,GDDR6 VRAM,,,,,,,,,,,Acer Nitro V Gaming
B0CQP1R949,https://www.amazon.in/Acer-i5-13420H-Graphics-Display-ANV15-51/dp/B0CQP1R949/ref=sr_1_45?dib=eyJ2IjoiMSJ9.et336k7YhQuRNJQqOUP0bz50Fs6EZ8AqsdCOjCxg5VBNyfd3scVlUyd-J5manTr1QCjr0F2XA6mF_shNFi6Cvd7pZCyzNQa7KXWA0tQjHwSQMhb9DVboIjTooPhWDmcaGLAj0ovBaYFvFAxjN1XIQQIZPxAyH86jdLYQZTiXpqk6fB04z_XowHw_wam3hlyXbDvJMaucuC5vtB4ZWYMIF5K3BL85zb_hFoFoOqbHRjM47Nklm3E_bK4_NF6vxkN6TIW_fWRPsFIr9BqREJfopf3b0BE6JmdwCbmPA6n5EA0.g0PpJH1ZPjjvjl3-1zamPLZBit6xir_CyDMvY-ubwmk&dib_tag=se&qid=1721801975&refinements=p_89%3AAcer&rnid=3837712031&s=computers&sr=1-45,"Acer Nitro V Gaming Laptop 13th Gen Intel Core i5-13420H with RTX 2050 Graphics 4 GB VRAM, 144Hz Display (16 GB DDR5/512GB SSD/Windows 11 Home/Wi-Fi 6),15.6""(39.6cms) FHD ANV15-51",2.8,2.0,," Processor: Intel Core i5-13420H processor - 8 cores, max turbo up to 4.60 Ghz | RAM : 16 GB of DDR5 system memory, upgradable to 32 GB (Memory Frequency: Up to 5200 MT/s) |  Display : 15.6"" display with IPS (In-Plane Switching) technology, Full HD 1920 x 1080, Acer ComfyView LED-backlit TFT LCD, 16:9 aspect ratio, supporting 144 Hz refresh rate |  Graphics : NVIDIA GeForce RTX 2050 with 4 GB of dedicated GDDR6; Storage : 512 GB SSD, PCIe Gen4, 16 Gb/s, NVMe ( Upgradable Upto 2*1 TB SSD) | OS : Windows 11 Home 64-bit |  Ports: 1 x USB 3.2 Gen 1 port with power-off charging, 1 x USB 3.2 Gen 1 port, 1 x USB Type-C port (Thunderbolt ) | Features: Backlit keyboard |  Battery Average Life: 5 hours",https://www.amazon.in/dp/B0CQP1R949,61530,https://m.media-amazon.com/images/I/51GGNToj7aL._SL1000_.jpg,9,"""https://m.media-amazon.com/images/I/51GGNToj7aL._SL1000_.jpg | https://m.media-amazon.com/images/I/61FuMLn3OZL._SL1000_.jpg | https://m.media-amazon.com/images/I/610Ow-kXICL._SL1000_.jpg | https://m.media-amazon.com/images/I/61YdpigJeJL._SL1000_.jpg | https://m.media-amazon.com/images/I/61mARPxX6XL._SL1000_.jpg | https://m.media-amazon.com/images/I/61sWhs4CI2L._SL1000_.jpg | https://m.media-amazon.com/images/I/619+y4cO4UL._SL1000_.jpg | https://m.media-amazon.com/images/I/615UH+Z-IRL._SL1000_.jpg | https://m.media-amazon.com/images/I/61Nx+OULAQL._SL1000_.jpg""","Acer Nitro V Gaming Laptop Intel Core i5-13420H Processor (Windows 11 Home/ 16 GB/ 512 GB SSD/ NVIDIA GeForce RTX 2050/ 144Hz) ANV15-51 with FHD 39.62 cm (15.6"") IPS Display, Obsidian Black, 2.1 KG",https://store.acer.com/en-in/acer-nitro-v-gaming-laptop-intel-core-i5-13420h-processor-windows-11-home-16-gb-512-gb-ssd-nvidia-geforce-rtx-2050-144hz-anv15-51-with-fhd-39-62-cm-15-6-ips-display-obsidian-black-2-1-kg-un-qnasi-002,,57 Wh,Lithium Ion (Li-Ion),Yes,Supports Bluetooth 5.1,Obsidian Black,23.98 cm,IPS (In-Plane Switching) Technology,,,,"E-mail: ail.easycare@acer.com Contact number：1800-11-6677 (For Laptop & Tablet), 1800-11-4100 ( For Desktop, Monitor & All in One ) Support Timings – 9:00 AM to 6:00 PM ( Monday to Saturday, except public holidays",E-mail: acerindia.enquiries@acer.com Contact number: 1860-120-2019,NVIDIA®️,NVIDIA GeForce RTX 2050 with 4 GB of dedicated GDDR6 VRAM,,Yes,,2.35 cm,,,99-/100-/103-key Acer keyboard layout with international language support including indicators of CapsLock and F4/Microphone mute,"Compal Electronics Pvt Ltd, No.D01, Zone D, Air Port Section of LiangLu CunTan Free Trade Port Area, YuBei District, Chongqing, China","ACER INDIA PRIVATE LIMITED Embassy Heights, 6th Floor, No. 13, Magrath Road, Next to HOSMAT Hospital, Bangalore, INDIA – 56002",Up to 32 GB,DDR 5,,,4.0,,,1.0,Windows 11 Home,64-bit,DTS X: Ultra Audio,"1U (contains Laptop 1N, Power cord 1N, Adapter 1N, User Manual 1N)","Multi-gesture secure touchpad, supporting two-finger scroll; pinch; gestures to open Cortana, Action Center, multitasking",3-pin 135 W AC adapter,,Intel Core i5-13420H processor,,,Core™ i5,,,,"512 GB, PCIe Gen4, 16 Gb/s, NVMe (Upgradable upto 2* 1TB)",,Yes,16 GB,"1 x USB 3.2 Gen 1 port with power-off charging, 2 x USB 3.2 Gen 1 port, 1 x USB Type-C port (Thunderbolt 4)",,Yes,One-year International Travelers Warranty (ITW),Yes,UFC with T-Type HD camera with 1280 x 720 resolution and 720p HD video at 30 fps with Temporal Noise Reduction,2.1 KG,36.23 cm,Yes,,Intel Wireless Wi-Fi 6 AX201,,,,,,,,,,,,,,,,,,Acer Nitro V Gaming
B0D45T32HD,https://www.amazon.in/Acer-Aspire-Intel-Core-12450H/dp/B0D45T32HD/ref=sr_1_48?dib=eyJ2IjoiMSJ9.et336k7YhQuRNJQqOUP0bz50Fs6EZ8AqsdCOjCxg5VBNyfd3scVlUyd-J5manTr1QCjr0F2XA6mF_shNFi6Cvd7pZCyzNQa7KXWA0tQjHwSQMhb9DVboIjTooPhWDmcaGLAj0ovBaYFvFAxjN1XIQQIZPxAyH86jdLYQZTiXpqk6fB04z_XowHw_wam3hlyXbDvJMaucuC5vtB4ZWYMIF5K3BL85zb_hFoFoOqbHRjM47Nklm3E_bK4_NF6vxkN6TIW_fWRPsFIr9BqREJfopf3b0BE6JmdwCbmPA6n5EA0.g0PpJH1ZPjjvjl3-1zamPLZBit6xir_CyDMvY-ubwmk&dib_tag=se&qid=1721801975&refinements=p_89%3AAcer&rnid=3837712031&s=computers&sr=1-48,"Acer Aspire 7 Intel Core i5 12th Gen 12450H - (8 GB/512 GB SSD/Windows 11 Home/4 GB Graphics/NVIDIA GeForce RTX 2050) A715-76G-59WG Gaming Laptop (15.6 Inch, Charcoal Black, 2.1 Kg)",,," Step into the realm of absolute performance and understated design with the Acer Aspire 7 Gaming Laptop. With exemplary hardware, intelligent thermal solutions, understated elegance, a brilliant display, lightning-fast connectivity, and smart communication features, it's a laptop that caters to your every need. Elevate your gaming and creative experiences to new heights with the Acer Aspire 7. It's time to unleash your potential and redefine what's possible."," At the core of the Acer Aspire 7 lies the latest 12th-gen Intel Core processors and the formidable NVIDIA GeForce RTX 2050. Together, they form a dynamic duo that can power through anything you throw their way. Demanding applications are no match for this gaming marvel. Need more? The memory is upgradable to a staggering 32 GB of DDR4, and you get a swift 512 GB of SSD for rapid data access. With this laptop, there's no task too demanding, no challenge too great. |  Performance doesn't mean much if your laptop can't handle the heat. That's where Acer's thermal wizardry comes into play. The Acer Aspire 7 features an air-inlet keyboard, a clever innovation that expels up to 10% more heat than a non-air inlet keyboard. It's all about keeping your laptop cool under pressure. Plus, you have the flexibility to tune your fan settings, optimising the thermal performance for maximum productivity. When you're in the zone, this laptop keeps it cool. |  Elegance and power coexist seamlessly in the Acer Aspire 7. The sleek, sharp 19.90 mm aluminum chassis, dressed in Charcoal Black, exudes sophistication. But there's more to this design than meets the eye. The elevating hinge not only adds a touch of uniqueness but also enhances ergonomics and cooling by elevating the laptop for improved airflow. It's a design that's as functional as it is beautiful. And when it's time to work or play in low-light conditions. |  Your gaming and creative endeavours deserve a canvas that does justice to your imagination. The Acer Aspire 7 delivers with its FHD IPS display, boasting an impressive 81.67% screen-to-body ratio. Acer BlueLightShield technology ensures viewing comfort, reducing eye strain during marathon gaming sessions or long editing stints. With Acer ExaColor technology, you have precise control over colours, ensuring that your visuals are as vibrant and accurate as your vision. |  In the world of high-speed file sharing, the Acer Aspire 7 is your ultimate companion. With seamless connectivity options, you can effortlessly transfer files at lightning speed. And when it's time to immerse yourself in entertainment, the Thunderbolt 4 port opens the door to a world of possibilities. Connect an 8K display for an immersive experience that's beyond compare. It's all about staying connected and entertained with minimal effort. |  Communication is more critical than ever, whether you're attending online courses or staying in touch with loved ones. Acer understands this, and that's why they've equipped the Aspire 7 with Acer PurifiedVoice featuring AI noise reduction. This intelligent technology actively suppresses background noise, ensuring crystal-clear audio for both you and the person on the other end of the line. |  And it doesn't stop there – it's compatible with external headphones and microphones, giving you the flexibility you need for any situation. With the Acer Aspire 7, your voice is heard, loud and clear.",https://www.amazon.in/dp/B0D45T32HD,53990,https://m.media-amazon.com/images/I/41LMzzdYO+L.jpg,9,"""https://m.media-amazon.com/images/I/41LMzzdYO+L.jpg | https://m.media-amazon.com/images/I/413JArAWUFL.jpg | https://m.media-amazon.com/images/I/41JPW93JGnL.jpg | https://m.media-amazon.com/images/I/41gl7NpGolL.jpg | https://m.media-amazon.com/images/I/31jNPO5GOIL.jpg | https://m.media-amazon.com/images/I/41E-l+Rt8OL.jpg | https://m.media-amazon.com/images/I/41HF+de1qcL.jpg | https://m.media-amazon.com/images/I/41u-2bnDpJL.jpg | https://m.media-amazon.com/images/I/41PKJCjGAFL.jpg""","Acer Aspire 7 Gaming Laptop 12th Gen Intel Core i5 (Windows 11 Home/ 8 (1*8) GB/ 512 GB SSD/ NVIDIA GeForce RTX 2050/144 Hz) A715-76G with 39.6 cm (15.6"") FHD Display and 45% NTSC Color Gamut, Charcoal Black, 2.1 KG",https://store.acer.com/en-in/acer-aspire-7-gaming-laptop-12th-gen-intel-core-i5-windows-11-home-8-gb-512-gb-ssd-nvidia-geforce-rtx-2050-144-hz-a715-76g-with-39-6-cm-15-6-fhd-display-and-45-ntsc-color-gamut-charcoal-black-2-1-kg-nh-qmysi-001,,50 Wh,Lithium Ion (Li-Ion),Yes,Supports Bluetooth 5.1,Charcoal Black,23.74 cm,IPS (In-Plane Switching) Technology,"39.6 cm (15.6"") IPS Display with Full HD 1920 x 1080, Acer ComfyView LED-backlit TFT LCD",,Yes,"E-mail: ail.easycare@acer.com Contact number：1800-11-6677 (For Laptop & Tablet), 1800-11-4100 ( For Desktop, Monitor & All in One ) Support Timings – 9:00 AM to 6:00 PM ( Monday to Saturday, except public holidays )",E-mail: acerindia.enquiries@acer.com Contact number: 1860-120-2019,NVIDIA®️,NVIDIA GeForce RTX 2050,,Yes,,1.99 cm,,Yes,"99-/100-/103-key Acer backlit keyboard with international language support, with indicators of CapsLock and F4/Microphone mute","QuantaTech-Front(Chongqing)Computer Co., Ltd(Quanta Chongqing), 18#,Zongbao Road, Shapingba District, Chongqing, China","ACER INDIA PRIVATE LIMITED Embassy Heights, 6th Floor, No. 13, Magrath Road, Next to HOSMAT Hospital, Bangalore, INDIA – 560025",32 GB,DDR4 SDRAM,,Yes,3.0,1.0,,,Windows 11 Home,64-bit,,"1U (contains Laptop 1N, Power cord 1N, Adapter 1N, User Manual 1N)","Multi-gesture secure touchpad, supporting two-finger scroll; pinch; gestures to open Cortana, Action Center, multitasking; Fingerprint application commands",3-pin 135 W AC Adapter,,Intel Core i5-12450H,,,Core™ i5,1920 x 1080,"39.6 cm (15.6"")",,"512 GB, PCIe Gen4, 16 Gb/s, NVMe",Stereo,Yes,8 GB,"2x USB 3.2 port, 1x USB USB 3.2 port with power-off  charging, 1x USB Type-C port  /Thunderbolt™ 4 port",512 GB,Yes,One-year International Travelers Warranty (ITW),Yes,T-Type HD camera with 1280 x 720 resolution and 720p HD video at 30 fps with Temporal Noise Reduction,2.1 KG,36.23 cm,Yes,,Wi-Fi 6E,,,,,Dedicated,,GDDR6,,,,,,,,,,,Acer Aspire 7 Gaming
