B0CH9VN5KB,https://www.amazon.in/Acer-Windows-GeForce-A515-58GM-Display/dp/B0CH9VN5KB/ref=sr_1_55?dib=eyJ2IjoiMSJ9.CYEZiowSTuew19GXd1_puqGDUi2ejnZV5i-kDd3a-ZOhJ7Q4eMh6AeA_ur2eGzq2QXvz1YNgh61uis6Tfr59ccFIjvf0pPeG9lpeVCyuDxTC1YEccLlinF5zlOFk2y97B0FErXWjgKLfsf__xuGfKl6Qb29Sfr-nXXQ1ZpHOIF7pdJipLMmsYo0aXEm8h_g0pzymY37HDWD9otBe11rhkoS5y0HE0vMz027x5-jwFy74FValAU929d9WJePO7qxX8zDYUNRwHz-cnKAt0O38aYNoJbYHUpMx86ncgK3Shmw.GKFPyQhWNbyA6vg_rsakWFwOGJK5O-e0-8hlKY50QEQ&dib_tag=se&qid=1721801979&refinements=p_89%3AAcer&rnid=3837712031&s=computers&sr=1-55,"Acer Aspire 5 Gaming Laptop 13th Gen Intel Core i5 (Windows 11 Home/ 8 GB RAM/ 512 GB SSD/NVIDIA GeForce RTX 2050), A515-58GM 39.62 cm (15.6"") IPS Full HD Display, Steel Gray, 1.78 KG",4.1,64.0,," Processor : Great Performance with the Intel Core i5-13420H Processor | Memory: 8 GB of onboard Dual-channel DDR4 SDRAM support | Storage: 512 GB SSD |  Display : 39.62cm (15.6"") Display with IPS (In-Plane Switching) technology, Full HD 1920 x 1080, Acer ComfyView LED-backlit TFT LCD |  Operating System: Windows 11 Home, Graphic: NVIDIA GeForce RTX 2050 |  Ports: 1 x Type-C with DC-in /Thunderbolt 4 port, 1 x USB 3.2 port, and 1 x USB port with power-off charging. |  Keyboard: 99-/100-/103-key Acer backlit keyboard with international language support, with indicators of CapsLock and F4/Microphone mute",https://www.amazon.in/dp/B0CH9VN5KB,55990,https://m.media-amazon.com/images/I/61ZWZtsK+vL._SL1080_.jpg,9,"""https://m.media-amazon.com/images/I/61ZWZtsK+vL._SL1080_.jpg | https://m.media-amazon.com/images/I/61GbchVZwyL._SL1080_.jpg | https://m.media-amazon.com/images/I/61QQnsEqbBL._SL1080_.jpg | https://m.media-amazon.com/images/I/61IDFi6AplL._SL1080_.jpg | https://m.media-amazon.com/images/I/61d8coGdDHL._SL1080_.jpg | https://m.media-amazon.com/images/I/61f+eiv7lPL._SL1080_.jpg | https://m.media-amazon.com/images/I/61Tl-+R8W4L._SL1080_.jpg | https://m.media-amazon.com/images/I/61QX94tKihL._SL1080_.jpg | https://m.media-amazon.com/images/I/61NoE5JANAL._SL1080_.jpg""","Acer Aspire 5 Gaming Laptop 13th Gen Intel Core i5-13420H Processor (Windows 11 Home/ 8 (1*8) GB/ 512 GB SSD/ NVIDIA GeForce RTX 2050 Graphics/144 Hz) A515-58GM with 39.6 cm (15.6"") Full HD Display, Steel Gray, 1.78 KG",https://store.acer.com/en-in/acer-aspire-5-gaming-laptop-13th-gen-intel-core-i5-13420h-processor-windows-11-home-8-1-8-gb-512-gb-ssd-nvidia-geforce-rtx-2050-graphics-144-hz-a515-58gm-with-39-6-cm-15-6-full-hd-display-steel-gray-1-78-kg-nx-kw1si-001,LED,50 Wh,Lithium Ion (Li-Ion),Yes,Support Bluetooth 5.1,Steel Gray,23.7 cm,IPS (In-Plane Switching) Technology,"39.6 cm (15.6"") IPS Display with Full HD 1920 x 1080, Acer ComfyViewTM LED-backlit TFT LCD, 16:9 aspect ratio, supporting 144 Hz refresh rate, Wide viewing angle up to 170 degrees, Ultra-slim design",,Yes,"E-mail: ail.easycare@acer.com Contact number：1800-11-6677 (For Laptop & Tablet), 1800-11-4100 ( For Desktop, Monitor & All in One ) Support Timings – 9:00 AM to 6:00 PM ( Monday to Saturday, except public holidays )",E-mail: acerindia.enquiries@acer.com Contact number: 1860-120-2019,NVIDIA®️,NVIDIA GeForce RTX 2050,,Yes,,1.79 cm,,Yes,"99-/100-/103-key Acer backlit keyboard with international language support, with indicators of CapsLock and F4/Microphone mute","COMPAL Electronics (CHONGQING) Co., Ltd. / No.D01, Zone D, Air Port Section of LiangLu CunTan Free Trade Port Area, YuBei District, Chongqing, China","ACER INDIA PRIVATE LIMITED Embassy Heights, 6th Floor, No. 13, Magrath Road, Next to HOSMAT Hospital, Bangalore, INDIA – 560025",Upgradable up to 32 GB using two soDIMM modules,DDR4 SDRAM,Yes,Yes,3.0,1.0,2,1.0,Windows 11 Home,64-bit,,"1U Contains (Laptop 1N, Power cord 1N, Adapter 1N, User Manual 1N)","Multi-gesture secure touchpad, supporting two-finger scroll; pinch; gestures to open Cortana, Action Center, multitasking; Fingerprint application commands",3-pin 90 W AC adapter,,Intel Core i5-13420H Processor,,,Core™ i5,Full HD 1920 x 1080,"39.6 cm (15.6"")",,"512 GB, PCIe Gen4, 16 Gb/s, NVMe - Upgradable up to 2 TB with dual M.2 Slot",Stereo,Yes,8 GB,"1 x USB 3.2 Gen 1 port, 1 x USB port with power-off charging, 1 x USB Type-C / Thunderbolt 4 port",512 GB,Yes,One-year International Travelers Warranty (ITW),Yes,"UFC with T-Type USB FHD camera, Compatible with Windows, 1920 x 1080 resolution and 1080p HD video at 60 fps with Temporal Noise Reduction",1.78 KG,36.1 cm,Yes,,802.11 a/b/g/n/ac/ax wireless LAN-wi-fi 6E,,,,,,,,,,,,,,,,,,Acer Aspire 5 Gaming
B0B3XSR6RH,https://www.amazon.in/Acer-Travelmate-i5-1135G7-Processor-TMP214-53/dp/B0B3XSR6RH/ref=sr_1_57?dib=eyJ2IjoiMSJ9.CYEZiowSTuew19GXd1_puqGDUi2ejnZV5i-kDd3a-ZOhJ7Q4eMh6AeA_ur2eGzq2QXvz1YNgh61uis6Tfr59ccFIjvf0pPeG9lpeVCyuDxTC1YEccLlinF5zlOFk2y97B0FErXWjgKLfsf__xuGfKl6Qb29Sfr-nXXQ1ZpHOIF7pdJipLMmsYo0aXEm8h_g0pzymY37HDWD9otBe11rhkoS5y0HE0vMz027x5-jwFy74FValAU929d9WJePO7qxX8zDYUNRwHz-cnKAt0O38aYNoJbYHUpMx86ncgK3Shmw.GKFPyQhWNbyA6vg_rsakWFwOGJK5O-e0-8hlKY50QEQ&dib_tag=se&qid=1721801979&refinements=p_89%3AAcer&rnid=3837712031&s=computers&sr=1-57,"Acer Travelmate Business Laptop Intel Core i5-1135G7 processor (16GB DDR4/ 512GB SSD/Intel Iris Xe Graphics/Windows 11 Home/MS Office) TMP214-53 with 35.56 cm (14.0"") Full HD Display",3.6,14.0,," High Performance : Encounter high speed processing with the latest 11th Gen Intel Core i5-1135G7 Processor |  Dual-channel DDR4 SDRAM support:16 GB of DDR4 system memory, upgradable to 32 GB using two soDIMM modules |  512 GB, PCIe Gen3, 8 Gb/s, NVMe SSD | Windows 11 Home |  Intel Iris X e Graphics | Microsoft Office Home & Student; 14"" display Full HD 1920 x 1080, Acer ComfyView |  Software Included: Microsoft Office 365; Human Interface Input: Microphonekeyboard; Wireless Communication Technology: Wi-Fi; Resolution: 1080p",https://www.amazon.in/dp/B0B3XSR6RH,48307,https://m.media-amazon.com/images/I/81zyK2duFoL._SL1500_.jpg,9,"""https://m.media-amazon.com/images/I/81zyK2duFoL._SL1500_.jpg | https://m.media-amazon.com/images/I/81+x7YnDs0L._SL1500_.jpg | https://m.media-amazon.com/images/I/81BOdsB9m0L._SL1500_.jpg | https://m.media-amazon.com/images/I/91mLnJCWe3L._SL1500_.jpg | https://m.media-amazon.com/images/I/81ctYhMNTlL._SL1500_.jpg | https://m.media-amazon.com/images/I/81BOdsB9m0L._SL1500_.jpg | https://m.media-amazon.com/images/I/91Soto8QHOL._SL1500_.jpg | https://m.media-amazon.com/images/I/8151LfjXUgL._SL1500_.jpg | https://m.media-amazon.com/images/I/81dn5B6eW1L._SL1500_.jpg""","Acer Travelmate Business Laptop 11th Gen Intel Core i5 ( Windows 11 Home/16 GB RAM/512 GB SSD) TMP214-53 with 35.5 cm (14"") FHD Display, 1.6 kg, Fingerprint Reader",https://store.acer.com/en-in/acer-travelmate-business-laptop-intel-core-i5-11th-gen-windows-11-pro-16gb-ram-512-gb-ssd-tmp214-53-with-35-5-cm-14-inches-fhd-display-1-6-kgs-un-vthsi-110,,48 Wh,Lithium Ion (Li-Ion),Yes,5,Black,23.6 cm,,"14"" HD 1366 x 768 resolution, Acer ComfyView  LED-backlit TFT LCD",Gigabit Ethernet,Yes,"E-mail: ail.easycare@acer.com Contact number：1800-11-6677 (For Laptop & Tablet), 1800-11-4100 ( For Desktop, Monitor & All in One ) Support Timings – 9:00 AM to 6:00 PM ( Monday to Saturday, except public holidays )",E-mail: acerindia.enquiries@acer.com Contact number: 1860-120-2019,Intel®,Intel Iris Xe Graphics,,Yes,Yes,1.99 cm,,,"87-/88-/91-key FineTip keyboard with Home, End, Pg Up, Pg Dn keys, international language support, power button, Spill Resistant Keyboard","ACER INDIA (PRIVATE) LTD, R.S. no 38/2, Sederapet Village,Villianur Commune,Puducherry-605111","ACER INDIA PRIVATE LIMITED, Embassy Heights, 6th Floor, No. 13, Magrath Road, Next to HOSMAT Hospital, Bangalore, INDIA – 560025",Upto 32 GB,DDR4 SDRAM,,Yes,3.0,1.0,,,Windows 11 Home,64-bit,,"1U (contains Laptop 1N, Power cord 1N, Adapter 1N, User Manual 1N)","Multi-gesture touchpad, supporting two-finger scroll; pinch; gestures to open Cortana, Action Center, multitasking; application commands",3-pin 45 W AC adapter,Quad-core (4 Core),Intel Core i5-1135G7 Processor,2.40 GHz,4.20 GHz,Core™ i5,,"35.6 cm (14"")",Discrete Trusted Platform Module 2.0 (TPM) solution,"512 GB, PCIe NVMe",Stereo,Yes,16 GB,"1 X USB 3.2 Gen 2 Type C[ Thunderbolt(TM) 4, 10Gbps, Display over USB C, USB charging 5V;3A, DCin port 20V;60W], 3 X USB 3.2 Gen 1 Type A[1 with power off charging",512 GB,Yes,3 years warranty ( 1 year on battery and adapter),Yes,"HD camera with 1280 x 720 resolution, 720p HD audio/video recording, super high dynamic range imaging (SHDR), and camera shutter cover",1.6 Kg,32.8 cm,Yes,Intel,Intel® Wireless Wi-Fi 6 AX201,IEEE 802.11 a/b/g/n+ac+ax,,,,,,,,,,,,Yes,,,,,Acer Travelmate Business Laptop
B0CCRV54Y7,https://www.amazon.in/Acer-Predator-Processor-Windows-GeForce/dp/B0CCRV54Y7/ref=sr_1_58?dib=eyJ2IjoiMSJ9.CYEZiowSTuew19GXd1_puqGDUi2ejnZV5i-kDd3a-ZOhJ7Q4eMh6AeA_ur2eGzq2QXvz1YNgh61uis6Tfr59ccFIjvf0pPeG9lpeVCyuDxTC1YEccLlinF5zlOFk2y97B0FErXWjgKLfsf__xuGfKl6Qb29Sfr-nXXQ1ZpHOIF7pdJipLMmsYo0aXEm8h_g0pzymY37HDWD9otBe11rhkoS5y0HE0vMz027x5-jwFy74FValAU929d9WJePO7qxX8zDYUNRwHz-cnKAt0O38aYNoJbYHUpMx86ncgK3Shmw.GKFPyQhWNbyA6vg_rsakWFwOGJK5O-e0-8hlKY50QEQ&dib_tag=se&qid=1721801979&refinements=p_89%3AAcer&rnid=3837712031&s=computers&sr=1-58,"Acer Predator Helios 16 Gaming Laptop 13th Gen Intel Core i7 Processor (16 GB/1 TB SSD/Windows 11 Home/NVIDIA GeForce RTX 4060) PH16-71, (16"") WQXGA Display",4.3,39.0,," New Intel Processor: Intel Core i7-13700HX Processor |  Internal Specifications: Dual-channel DDR5 SDRAM support 16 GB of DDR5 system memory, Upgradable up to 32 GB of DDR5 system memory |  Display: 16.0"" display with IPS (In-Plane Switching) technology, WQXGA 2560 x 1600, high-brightness (400 nits) Acer ComfyView LED-backlit TFT LCD, supporting 240 Hz, Grey to Grey 3 ms by Overdrive, Nvidia Advanced Optimus capable. 16:10 aspect ratio, DCI-P3 100%, Wide viewing angle up to 170 degrees, Ultra-slim design, Mercury free, environment friendly |  Graphics: NVIDIA GeForce RTX 4060 with 8 GB of dedicated GDDR6 VRAM |  Other Features: NVIDIA Advance Optimus, Liquid Metal 5th Gen Aeroblade 3D Fan, Full-Function Thunderbolt-4, HDMI 2.1",https://www.amazon.in/dp/B0CCRV54Y7,154990,https://m.media-amazon.com/images/I/51MfOw+lbEL._SL1280_.jpg,8,"""https://m.media-amazon.com/images/I/51MfOw+lbEL._SL1280_.jpg | https://m.media-amazon.com/images/I/61gGSJYdEDL._SL1280_.jpg | https://m.media-amazon.com/images/I/61GwcaBOFmL._SL1280_.jpg | https://m.media-amazon.com/images/I/61aJOckNcwL._SL1280_.jpg | https://m.media-amazon.com/images/I/514YEh70EkL._SL1280_.jpg | https://m.media-amazon.com/images/I/41Zqr2ubVEL._SL1280_.jpg | https://m.media-amazon.com/images/I/31vEcuwRKIL._SL1280_.jpg | https://m.media-amazon.com/images/I/315N91x1ZHL._SL1280_.jpg""","Acer Predator Helios 16 Gaming Laptop 13th Gen Intel Core i7 (Windows 11 Home/16 GB RAM/512 GB SSD/NVIDIA® GeForce RTX™ 4060) PH16-71, WQXGA Display 240Hz DCI-P3 DDS, Abyssal Black, 2.7 KG",https://store.acer.com/en-in/acer-predator-helios-16-gaming-laptop-13th-gen-intel-core-i7-windows-11-home-16-gb-ram-512-gb-ssd-nvidiar-geforce-rtxtm-4060-ph16-71-wqxga-display-abyssal-black-2-7-kg,,90 Wh,Lithium Ion (Li-Ion),Yes,Support Bluetooth® 5.1,Black,27. cm,IPS (In-Plane Switching) technology,"40.64 cm (16"") IPS Display with WQXGA 2560 x 1600, high-brightness (500 nits) Acer ComfyView LED-backlit TFT LCD,supporting 240 Hz, Grey to Grey 3 ms by Overdrive, Nvidia Advanced Optimus capable",,,"E-mail: ail.easycare@acer.com Contact number：1800-11-6677 (For Laptop & Tablet), 1800-11-4100 ( For Desktop, Monitor & All in One ) Support Timings – 9:00 AM to 6:00 PM ( Monday to Saturday, except public holidays )",E-mail: acerindia.enquiries@acer.com Contact number: 1860-120-2019,NVIDIA®️,NVIDIA® GeForce RTX™ 4060 with 8 GB of dedicated GDDR6 VRAM,,Yes,,2.49 cm,,Yes,"103-/104-/107-key FineTip RGB Per-Key backlit keyboard, individual mini LED(s) under each keycap with independent standard numeric keypad, international language support","Quanta, Tech-Front(Chongqing)Computer Co., Ltd (Quanta Chongqing), 18#,Zongbao Road, Shapingba District, Chongqing, China","ACER INDIA PRIVATE LIMITED Embassy Heights, 6th Floor, No. 13, Magrath Road, Next to HOSMAT Hospital, Bangalore, INDIA – 560025",32 GB,DDR 5,,,4.0,,,,Windows 11 Home,64-bit,,"1U (contains Laptop 1N, Power cord 1N, Adapter 1N, User Manual 1N)","Multi-gesture touchpad, supporting two-finger scroll; pinch; gestures to open Cortana, Action Center, multitasking; application commands",3-pin 330 W 5.5 PHY AC Adapter,,Intel® Core™ i7-13700HX,,,Core™ i7,,"40.6 cm (16"")",,"512 GB , PCIe Gen4, 16 Gb/s, NVMe",Stereo,Yes,16 GB,"1x USB 3.2 Gen 1 port, 1x USB 3.2 Gen 2 port, 1x USB 3.2 Gen 2 port with power-off charging, 2x USB Type-C™ ports (Thunderbolt™ 4)",,Yes,One-year International Travelers Warranty (ITW),Yes,Narrow USB FHD camera with blue glass with 1920 x 1080 resolution and 1080p HD video at 60 fps with Temporal Noise Reduction,2.7 KG,35.7 cm,Yes,,Killer Wireless Wi-Fi 6E 1675i,,,,,Dedicated,,,,,,,,,,,,,Acer Predator Helios 16
B0D45TZ39G,https://www.amazon.in/Acer-Aspire-Intel-Core-12450H/dp/B0D45TZ39G/ref=sr_1_59?dib=eyJ2IjoiMSJ9.CYEZiowSTuew19GXd1_puqGDUi2ejnZV5i-kDd3a-ZOhJ7Q4eMh6AeA_ur2eGzq2QXvz1YNgh61uis6Tfr59ccFIjvf0pPeG9lpeVCyuDxTC1YEccLlinF5zlOFk2y97B0FErXWjgKLfsf__xuGfKl6Qb29Sfr-nXXQ1ZpHOIF7pdJipLMmsYo0aXEm8h_g0pzymY37HDWD9otBe11rhkoS5y0HE0vMz027x5-jwFy74FValAU929d9WJePO7qxX8zDYUNRwHz-cnKAt0O38aYNoJbYHUpMx86ncgK3Shmw.GKFPyQhWNbyA6vg_rsakWFwOGJK5O-e0-8hlKY50QEQ&dib_tag=se&qid=1721801979&refinements=p_89%3AAcer&rnid=3837712031&s=computers&sr=1-59,"Acer Aspire 7 Intel Core i5 12th Gen 12450H - (16 GB/512 GB SSD/Windows 11 Home/4 GB Graphics/NVIDIA GeForce RTX 3050/144 Hz) A715-76G Gaming Laptop (15.6 Inch, Charcoal Black, 2.1 Kg)",1.0,2.0," Get yourself a powerful laptop that can satisfy all your gaming needs. Sporting an array of stunning features like 12th Gen Intel Core processor, NVIDIA GeForce GTXTM 3050 with large storage capacity this laptop ensures fast and smooth performance. The air inlet keyboard ensures that your system doesn't overheat during intense gaming sessions. It has a sleek and stylish design built in aluminium chassis. It also comes with a backlit keyboard which adds to its total style. The FHD IPS display with a screen-to-body ratio of 81.67% along with other features like Acer BlueLightShield and Acer ExaColour technology provide a comfortable viewing experience. This Acer laptop has a Thunderbolt 4 port so that you can connect external devices to level up your gaming. With AI voice reduction you can enjoy noise-free video calling sessions with friends and family."," Equipped with the power of a 12th Gen Intel Core processor and NVIDIA GeForce GTXTM 3050 with 4G-GDDR6 memory you can explore a whole new world of gaming. You can upgrade this Acer laptop up to 32 GB with the applications you like, thanks to the Dual Channel DDR4 and 512 SSD. |  Courtesy to the air inlet keyboard featured in this gaming laptop, it prevents your system from overheating during intense gaming sessions and enhances the performance and productivity. |  This laptop is stylishly designed in a 19.90 mm aluminium chassis with an elevating hinge. The backlit keyboard not only adds to the aesthetic beauty but also enhances your productivity. |  The FHD IPS display of this laptop has a 81.67% screen-to-body ratio to ensure an immersive viewing experience. The Acer ComfyViewTM LED backlit TFT LCD IPS technology, Acer BlueLightShield, and Acer ExaColour technology enhances your viewing comfort. |  You can easily connect an 8K display and also transfer files at high speed with the Thunderbolt 4 port. |  The Acer PurifiedVoice’s AI noise reduction suppresses the background noise and ensures a high-quality calling experience on this laptop so that you can stay connected with your friends and family. |  And it doesn't stop there – it's compatible with external headphones and microphones, giving you the flexibility you need for any situation. With the Acer Aspire 7, your voice is heard, loud and clear.",https://www.amazon.in/dp/B0D45TZ39G,59980,https://m.media-amazon.com/images/I/41osfQIH7iL.jpg,9,"""https://m.media-amazon.com/images/I/41osfQIH7iL.jpg | https://m.media-amazon.com/images/I/41g7A7dxV0L.jpg | https://m.media-amazon.com/images/I/41u3ylzkzoL.jpg | https://m.media-amazon.com/images/I/41gl7NpGolL.jpg | https://m.media-amazon.com/images/I/31bqg6vNwfL.jpg | https://m.media-amazon.com/images/I/319JgyckviL.jpg | https://m.media-amazon.com/images/I/41FNSE0HG7L.jpg | https://m.media-amazon.com/images/I/41jd7r--ixL.jpg | https://m.media-amazon.com/images/I/41hhw7SlJCL.jpg""","Acer Aspire 7 Gaming Laptop 12th Gen Intel Core i5 (Windows 11 Home/16 (1*16) GB/512 GB SSD/NVIDIA GeForce RTX 3050/144 Hz) A715-76G with 39.6 cm (15.6"") FHD Display, Charcoal Black, 2.1 KG",https://store.acer.com/en-in/acer-aspire-7-gaming-laptop-12th-gen-intel-core-i5-windows-11-home-16-1-16-gb-512-gb-ssd-nvidia-geforce-rtx-3050-144-hz-a715-76g-with-39-6-cm-15-6-fhd-display-charcoal-black-2-1-kg-nh-qmfsi-004,,50 Wh,Lithium Ion (Li-Ion),Yes,Supports Bluetooth 5.1,Charcoal Black,23.74 cm,IPS (In-Plane Switching) Technology,"15.6"" display with IPS (In-Plane Switching) technology, Full HD 1920 x 1080, Acer ComfyView LED-backlit TFT LCD",,Yes,"E-mail: ail.easycare@acer.com Contact number：1800-11-6677 (For Laptop & Tablet), 1800-11-4100 ( For Desktop, Monitor & All in One ) Support Timings – 9:00 AM to 6:00 PM ( Monday to Saturday, except public holidays )",E-mail: acerindia.enquiries@acer.com Contact number: 1860-120-2019,NVIDIA®️,NVIDIA GeForce RTX 3050 with dedicated 4G-GDDR6 VRAM,,Yes,,1.99 cm,,Yes,"99-/100-/103-key Acer backlit keyboard with international language support, with indicators of CapsLock and F4/Microphone mute","QuantaTech-Front(Chongqing)Computer Co., Ltd(Quanta Chongqing), 18#,Zongbao Road, Shapingba District, Chongqing, China","ACER INDIA PRIVATE LIMITED Embassy Heights, 6th Floor, No. 13, Magrath Road, Next to HOSMAT Hospital, Bangalore, INDIA – 560025",32 GB,DDR4 SDRAM,,,3.0,1.0,2,1.0,Windows 11 Home,64-bit,,"1U (contains Laptop 1N, Power cord 1N, Adapter 1N, User Manual 1N)","Multi-gesture secure touchpad, supporting two-finger scroll; pinch; gestures to open Cortana, Action Center, multitasking; Fingerprint application commands",3-pin 135 W AC Adapter,,Intel Core i5-12450H,,,Core™ i5,,"39.6 cm (15.6"")",,"512 GB, PCIe Gen4, 16 Gb/s, NVMe",Stereo,Yes,16 GB,"2x USB 3.2 port, 1x USB USB 3.2 port with power-off  charging, 1x USB Type-C port  /Thunderbolt™ 4 port",512 GB,Yes,One-year International Travelers Warranty (ITW),Yes,T-Type HD camera with 1280 x 720 resolution and 720p HD video at 30 fps with Temporal Noise Reduction,2.1 KG,36.23 cm,Yes,,Intel Wireless Wi-Fi 6E AX201,,,,,Dedicated,,GDDR6,,,,,,,,,,,Acer Aspire 7 Gaming
B0C5D32X14,https://www.amazon.in/Acer-Aspire-Windows-A515-58M-Display/dp/B0C5D32X14/ref=sr_1_65?dib=eyJ2IjoiMSJ9.CYEZiowSTuew19GXd1_puqGDUi2ejnZV5i-kDd3a-ZOhJ7Q4eMh6AeA_ur2eGzq2QXvz1YNgh61uis6Tfr59ccFIjvf0pPeG9lpeVCyuDxTC1YEccLlinF5zlOFk2y97B0FErXWjgKLfsf__xuGfKl6Qb29Sfr-nXXQ1ZpHOIF7pdJipLMmsYo0aXEm8h_g0pzymY37HDWD9otBe11rhkoS5y0HE0vMz027x5-jwFy74FValAU929d9WJePO7qxX8zDYUNRwHz-cnKAt0O38aYNoJbYHUpMx86ncgK3Shmw.GKFPyQhWNbyA6vg_rsakWFwOGJK5O-e0-8hlKY50QEQ&dib_tag=se&qid=1721801979&refinements=p_89%3AAcer&rnid=3837712031&s=computers&sr=1-65,"Acer Aspire 5 13th Gen Intel Core i5 (16 GB RAM/512 GB SSD/Windows 11 Home/MS Office), A515-58M 15.6"" Full HD IPS 45% NTSC Display, Steel Gray, 1.75 KG",3.6,17.0," Processor : Great Performance with the Intel Core i5-1335U Processor | Memory: 16 GB of onboard LPDDR5 SDRAM support | Storage: 512 GB SSD, Display : 15.6"" display with IPS (In-Plane Switching) technology, Full HD 1920 x 1080, Acer ComfyView™ LED-backlit TFT LCD | 16:9 aspect ratio, 45% NTSC color gamut, Operating System : Windows 11 Home| Pre-Installed Software: MS Office, Graphic : Intel Iris Xe Graphics, Made from recycled materials for less harm and more earthy goodness, we use 30% PCR plastic in our chassis and screen bezel and 50% on our keycaps to become a pioneer of full PCR integration into a laptop device. Featuring Computer Protection and Windows Hello Certification. 802.11ax, Ports: one Type-C with DC-in /Thunderbolt™ 4 port, one Type-A port, and one Type-A port with power-off charging, Battery: Up to 14 Hours Battery Life, Keyboard: 99-/100-/103-key Acer backlit keyboard with international language support, with indicators of CapsLock and F4/Microphone mute with Media control keys (printed on keyboard): volume up, volume down."," Processor : Great Performance with the Intel Core i5-1335U Processor | Memory: 16 GB of onboard LPDDR5 SDRAM support | Storage: 512 GB SSD |  Display : 15.6"" display with IPS (In-Plane Switching) technology, Full HD 1920 x 1080, Acer ComfyView LED-backlit TFT LCD | 16:9 aspect ratio, 45% NTSC color gamut |  Operating System : Windows 11 Home| Pre-Installed Software: MS Office, Graphic : Intel Iris Xe Graphics |  Ports: one Type-C with DC-in /Thunderbolt 4 port, one Type-A port, and one Type-A port with power-off charging, Battery: Up to 14 Hours Battery Life. |  Keyboard: 99-/100-/103-key Acer backlit keyboard with international language support, with indicators of CapsLock and F4/Microphone mute with Media control keys (printed on keyboard): volume up, volume down.",https://www.amazon.in/dp/B0C5D32X14,55623,https://m.media-amazon.com/images/I/81x3tKnUBaL._SL1500_.jpg,9,"""https://m.media-amazon.com/images/I/81x3tKnUBaL._SL1500_.jpg | https://m.media-amazon.com/images/I/812dJpYU-KL._SL1500_.jpg | https://m.media-amazon.com/images/I/81IRerTj4JL._SL1500_.jpg | https://m.media-amazon.com/images/I/718tNmSZnLL._SL1500_.jpg | https://m.media-amazon.com/images/I/71vwLcy4XGL._SL1500_.jpg | https://m.media-amazon.com/images/I/81G5VAY4oOL._SL1500_.jpg | https://m.media-amazon.com/images/I/71P83Wfe4gL._SL1500_.jpg | https://m.media-amazon.com/images/I/81ipTl+OXpL._SL1500_.jpg | https://m.media-amazon.com/images/I/81C6Du65m7L._SL1500_.jpg""","Acer Aspire 5 Thin and Light Laptop 13th Gen Intel Core i5-1335U Processor (Windows 11 Home/16 GB/512 GB SSD/Microsoft Office) A515-58M with 39.6 cm (15.6"") Full HD Display, Steel Gray, 1.75 KG",https://store.acer.com/en-in/acer-aspire-5-thin-and-light-laptop-13th-gen-intel-core-i5-1335u-processor-windows-11-home-16-gb-512-gb-ssd-microsoft-office-a515-58m-with-39-6-cm-15-6-full-hd-display-steel-gray-1-75-kg-nx-khfsi-007,LED,50 Wh,Lithium Ion (Li-Ion),Yes,Support Bluetooth 5.1,Steel Gray,23.7 cm,LCD,"39.6 cm (15.6"") Full HD 1920 x 1080, high-brightness Acer ComfyView LED-backlit TFT LCD",,,"E-mail: ail.easycare@acer.com Contact number：1800-11-6677 (For Laptop & Tablet), 1800-11-4100 ( For Desktop, Monitor & All in One ) Support Timings – 9:00 AM to 6:00 PM ( Monday to Saturday, except public holidays )",E-mail: acerindia.enquiries@acer.com Contact number: 1860-120-2019,Intel®,Intel Iris Xe Graphics,,Yes,,1.79 cm,,Yes,"99-/100-/103-key Acer backlit keyboard with international language support, with indicators of CapsLock and F4/Microphone mute","COMPAL Electronics (CHONGQING) Co., Ltd. / No.D01, Zone D, Air Port Section of LiangLu CunTan Free Trade Port Area, YuBei District, Chongqing, China","ACER INDIA PRIVATE LIMITED Embassy Heights, 6th Floor, No. 13, Magrath Road, Next to HOSMAT Hospital, Bangalore, INDIA – 560025",,LPDDR5,,,3.0,,,,Windows 11 Home,64-bit,,"1U (contains Laptop 1N, Power cord 1N, Adapter 1N, User Manual 1N)","Multi-gesture touchpad, supporting two-finger scroll; pinch; gestures to open Cortana, Action Center, multitasking; application commands",3-pin 65 W AC adapter,,Intel Core i5-1335U,,,Core™ i5,,"39.6 cm (15.6"")",,"512 GB, PCIe Gen4, 16 Gb/s, NVMe",,Yes,16 GB,"1x USB 3.2 Gen 1 port, 1x USB 3.2 Gen 1 port with power-off charging, 1x USB Type-C / Thunderbolt 4 port",512 GB,Yes,One-year International Travelers Warranty (ITW),Yes,"T-Type USB FHD camera, 1920 x 1080 resolution, 1080p HD video at 60 fps with Temporal Noise Reduction",1.75 KG,36.2 cm,Yes,,2x2 AX Wi-Fi 6E,,,,,,,,,,,,,,,,,,Acer Aspire 5
