ASIN,Product_URL,Product_Title,Rating,Total_Reviews,Description,Feature_Bullets,URL,Price,Main_Image,Total_Images,Images,Title,Link,Backlight Technology,Battery Capacity,Battery Chemistry,Bluetooth,Bluetooth Standard,Color,Depth,Display Screen Technology,Display Screen Type,Ethernet Technology,Fingerprint Reader,For Post-Sales Warranty Support,For Pre-Sales Queries,Graphics Controller Manufacturer,Graphics Controller Model,HD Audio,HDMI,Headphone,Height,Imported on or after,Keyboard Backlight,Keyboard Type,Manufacturer's Name & Address,Marketed & Imported by,Maximum Memory,Memory Technology,Microphone,Network (RJ-45),Number of Cells,Number of HDMI Ports,Number of Speakers,Number of Total Memory Slots,Operating System,Operating System Architecture,Output Power,Package Contents,Pointing Device Type,Power Supply,Processor Core,Processor Model,Processor Speed,Processor Speed (turbo),Processor Type,Screen Resolution,Screen Size,Security Features,Solid State Drive Interface,Speaker Output Mode,Speakers,Standard Memory,Total Number of USB Ports,Total Solid State Drive Capacity,USB,Warranty,Webcam,Webcam Resolution (front),Weight (Approximate),Width,Wireless LAN,Wireless LAN Manufacturer,Wireless LAN Model,Wireless LAN Standard,Hard Drive Interface,Input Voltage,Additional Information,Graphics Memory Accessibility,Graphics Memory Capacity,Graphics Memory Technology,Maximum Battery Run Time,Multi-touch Screen,Optical Drive Type,Touchscreen,Total number micro-USB ports,VGA,Flash Memory Capacity,Number of Hard Drives,Total Hard Drive Capacity,Memory Card Reader,Laptop_name
B0CKLN7PSZ,https://www.amazon.in/Acer-i3-1215U-Premium-Windows-AL15-52/dp/B0CKLN7PSZ/ref=sr_1_1?dib=eyJ2IjoiMSJ9.OEYfzYNd95GjvreCKceOJ45NuVSCPThbajjCbnE8d2PR5sHDumC2UUvei1Gf0tUYql2bPOEBI89QcuBbn2O4p4gZqX260L37uw-I2u4OiMjI_i4qmDuNV4N7P34r1vJmOuALodHVFDb8XDHMSPYAThjLN4wWaBN9SNAMod1gtNdQqNBzFDNMBO09-QzV8nTyT4NQi5UvslT7DrOqhfpF4LRQEMY5VoGAfEIGEokAA-lH79TFNUFc9_Hj6tZvz4SNfcgFbYFwes6u5h-uLWDZCu0RuwH6can-il1zG7-Y0C8.BUlfE9bB305UmQ_zeLF8x16caOZxC-tbIY9g1X7NsAQ&dib_tag=se&qid=1721801973&refinements=p_89%3AAcer&rnid=3837712031&s=computers&sr=1-1,"Acer Aspire Lite 12th Gen Intel Core i3-1215U Premium Metal Laptop (Windows 11 Home/8 GB RAM/512GB SSD) AL15-52, 39.62cm (15.6"") Full HD Display, Metal Body, Steel Gray, 1.59 Kg",4.0,821.0,," Powerful Productivity: 12th Generation Intel Core i3-1215U Dual Core processor delivers unmatched speed and intelligence, enabling impressive creating, productivity, and gaming experiences. With Turbo Boost Technology, get up to 4.4GHz for your high-demand applications. Connectivity Technology: Wi-Fi, Bluetooth, HDMI |  Visibly Stunning: Experience sharp details and crisp colors on the 15.6"" Full HD display, 16:9 aspect ratio, ultra-slim design and narrow bezels. |  Internal Specifications: RAM - 8 GB of Dual-channel DDR4, 2 SODIMM sockets; Storage - 512 GB SSD NVMe solid-state drive storage (expandable up to 1TB) to store your files and media |  Ports: one Type-C port, two USB 2.0 Type-A port, and one USB 3.2 Type-A port. |  Keyboard: 100-/101-/104-key keyboard with independent numeric keypad, international language support",https://www.amazon.in/dp/B0CKLN7PSZ,29990,https://m.media-amazon.com/images/I/71czGb00k5L._SL1500_.jpg,7,"""https://m.media-amazon.com/images/I/71czGb00k5L._SL1500_.jpg | https://m.media-amazon.com/images/I/91osomWARhL._SL1500_.jpg | https://m.media-amazon.com/images/I/81PDfXu4pUL._SL1500_.jpg | https://m.media-amazon.com/images/I/715tDe1ADAL._SL1000_.jpg | https://m.media-amazon.com/images/I/71xcBBdAX9L._SL1500_.jpg | https://m.media-amazon.com/images/I/61Xkk+I8kGL._SL1000_.jpg | https://m.media-amazon.com/images/I/61zDpKrm9KL._SL1000_.jpg""","Acer Aspire Lite 12th Gen Intel Core i3-1215U Processor Laptop (Windows 11 Home/ 8 GB RAM/ 512 GB SSD/Microsoft Office) AL15-52 with 39.6 cm (15.6"") Full HD Laptop, Steel Gray, 1.59 KG",https://store.acer.com/en-in/acer-aspire-lite-12th-gen-intel-core-i3-1215u-processor-laptop-windows-11-home-8-gb-ram-512-gb-ssd-microsoft-office-al15-52-with-39-6-cm-15-6-full-hd-laptop-steel-gray-1-59-kg-un-431si-341,,36 Wh,Lithium Ion (Li-Ion),Yes,Bluetooth 5.0,Steel Gray,23.93 cm,,"15.6"" FHD 1920 x 1080, high-brightness Acer ComfyView LED-backlit TFT LCD",,,"E-mail: ail.easycare@acer.com
Contact number：1800-11-6677 (For Laptop & Tablet), 1800-11-4100 ( For Desktop, Monitor & All in One )
Support Timings – 9:00 AM to 6:00 PM ( Monday to Saturday, except public holidays )","E-mail: acerindia.enquiries@acer.com
 Contact number: 1860-120-2019",Intel®,Intel UHD Graphics,Yes,Yes,,1.97 cm,,,"100-/101-/104-key keyboard with independent numeric keypad, international language support","Huaqin, Nanchang HuaQin Electronic Technology Co., Ltd. No. 2999 Tianxiang Road, High-tech Zone, Nanchang , Jiangxi, China","ACER INDIA PRIVATE LIMITED Embassy Heights, 6th Floor, No. 13, Magrath Road, Next to HOSMAT Hospital, Bangalore, INDIA – 560025",Upgradable up to 64 GB of DDR4 3200 MHz,DDR4 SDRAM,Yes,Yes,3.0,1.0,2,,Windows 11 Home,64-bit,,"1U contains (Laptop 1N, Power cord 1N, Adapter 1N, User Manual 1N)","Multi-gesture touchpad, Built in Click pad with Microsoft PTP multi-gesture and scrolling function",45W Fast Charging,,Intel Core i3 - 1215U,,,Core™ i3,1920 x 1080,"39.6 cm (15.6"")",,"512 GB, PCIe Gen3, NVMe, Support up to 1 TB",Stereo,Yes,8 GB,"1 x USB 3.2 Gen2 (Type A), 1 x USB 3.2 Gen1 (Type A), 1 x USB 2.0 (Type A), 1 x USB 3.2 Gen2 (Type C) and 1 x DC-in jack",512 GB,Yes,One Year Warranty,Yes,"HD Webcam with 1280 x 720 resolution, 720p HD audio/video recording",1.59 KG,36.04 cm,Yes,,Realtek 8822 CE WLAN + BT 5.0,IEEE 802.11 a/b/g/n+ac+ax,,100~240V,,,,,,,,,,,,,,,Acer Aspire Lite
B0CB7S1RTX,https://www.amazon.in/Acer-Premium-Windows-AL15-41-Display/dp/B0CB7S1RTX/ref=sr_1_2?dib=eyJ2IjoiMSJ9.OEYfzYNd95GjvreCKceOJ45NuVSCPThbajjCbnE8d2PR5sHDumC2UUvei1Gf0tUYql2bPOEBI89QcuBbn2O4p4gZqX260L37uw-I2u4OiMjI_i4qmDuNV4N7P34r1vJmOuALodHVFDb8XDHMSPYAThjLN4wWaBN9SNAMod1gtNdQqNBzFDNMBO09-QzV8nTyT4NQi5UvslT7DrOqhfpF4LRQEMY5VoGAfEIGEokAA-lH79TFNUFc9_Hj6tZvz4SNfcgFbYFwes6u5h-uLWDZCu0RuwH6can-il1zG7-Y0C8.BUlfE9bB305UmQ_zeLF8x16caOZxC-tbIY9g1X7NsAQ&dib_tag=se&qid=1721801973&refinements=p_89%3AAcer&rnid=3837712031&s=computers&sr=1-2,"Acer Aspire Lite AMD Ryzen 5 5500U Premium Thin and Light Laptop (16 GB RAM/512 GB SSD/Windows 11 Home) AL15-41, 39.62 cm (15.6"") Full HD Display, Metal Body, Steel Gray, 1.59 KG",3.9,452.0,," Processor : AMD Ryzen 5 5500U Hexa-Core Mobile Processor with AMD Radeon Graphics.Maximum Power Supply Wattage 45 W |  Visibly Stunning: Experience sharp details and crisp colors on the 15.6"" Full HD display, 16:9 aspect ratio, ultra-slim design and narrow bezels. |  Internal Specifications: RAM - 16 GB of Dual-channel DDR4, 2 SODIMM sockets; Storage - 512 GB SSD NVMe solid-state drive storage (expandable up to 1TB) to store your files and media |  Ports: 1 x USB 3.2 Gen 1 (Type A), 2 x USB 2.0 (Type A), 1 x USB 3.2 Gen 2 (Type C), 1 x DC-in jack; Keyboard: 100-/101-/104-key keyboard with independent numeric keypad, international language support |  Chipset Type: Amd B560; Model: Al15-51",https://www.amazon.in/dp/B0CB7S1RTX,33999,https://m.media-amazon.com/images/I/71czGb00k5L._SL1500_.jpg,9,"""https://m.media-amazon.com/images/I/71czGb00k5L._SL1500_.jpg | https://m.media-amazon.com/images/I/91uEdp5TfjL._SL1500_.jpg | https://m.media-amazon.com/images/I/81aCWSKdz-L._SL1500_.jpg | https://m.media-amazon.com/images/I/71xcBBdAX9L._SL1500_.jpg | https://m.media-amazon.com/images/I/71T05W0naVL._SL1500_.jpg | https://m.media-amazon.com/images/I/81+lrkkpz6L._SL1500_.jpg | https://m.media-amazon.com/images/I/51+tpdYgxDL._SL1000_.jpg | https://m.media-amazon.com/images/I/81iZd--MhCL._SL1500_.jpg | https://m.media-amazon.com/images/I/31sFGwOZc9L._SL1000_.jpg""","Acer Aspire Lite AMD Ryzen 5-5500U Processor Laptop (Windows 11 Home/ 16 GB/ 512 GB SSD) AL15-41 with 39.6 cm (15.6"") Full HD Display, Multi Color Backlit Keyboard, Steel Gray, 1.59 KG",https://store.acer.com/en-in/acer-aspire-lite-amd-ryzen-5-5500u-processor-laptop-windows-11-home-16-gb-512-gb-ssd-al15-41-with-39-6-cm-15-6-full-hd-display-multi-color-backlit-keyboard-steel-gray-1-59-kg-un-31zsi-00y,,36 Wh,Lithium Ion (Li-Ion),Yes,Supports Bluetooth 5.2,Steel Gray,23.93 cm,,"39.6 cm (15.6"") FHD 1920 x 1080, high-brightness Acer ComfyView LED-backlit TFT LCD",,,"E-mail: ail.easycare@acer.com
Contact number：1800-11-6677 (For Laptop & Tablet), 1800-11-4100 ( For Desktop, Monitor & All in One )
Support Timings – 9:00 AM to 6:00 PM ( Monday to Saturday, except public holidays )","E-mail: acerindia.enquiries@acer.com
 Contact number: 1860-120-2019",AMD Radeon™,AMD Radeon Graphics,Yes,Yes,,1.99 cm,,,"100-/101-/104-key keyboard with independent numeric keypad, international language support","Huaqin, Nanchang HuaQin Electronic Technology Co., Ltd. No. 2999 Tianxiang Road, High-tech Zone, Nanchang , Jiangxi, China","ACER INDIA PRIVATE LIMITED Embassy Heights, 6th Floor, No. 13, Magrath Road, Next to HOSMAT Hospital, Bangalore, INDIA – 560025",,DDR4 SDRAM,,Yes,3.0,,2,,Windows 11 Home,64-bit,,"1U contains (Laptop 1N, Power cord 1N, Adapter 1N, User Manual 1N)","Multi-gesture touchpad, Built in Click pad with Microsoft PTP multi-gesture and scrolling function",45 W AC adapter,,AMD Ryzen 5 5500U,,,Ryzen™ 5,,"39.6 cm (15.6"")",,"512 GB, PCIe Gen3, 8 Gb/s up to 4 lanes, NVMe",Stereo,Yes,16 GB,"1 x USB 3.2 Gen1 (Type A), 2 x USB 2.0 (Type A), 1 x USB 3.2 Gen2 (Type C) and 1 x DC-in jack",512 GB,Yes,One Year Warranty,Yes,"HD Webcam with 1280 x 720 resolution, 720p HD audio/video recording",1.59 KG,36.04 cm,Yes,,WIFI 5 + BT 5.2,,,,,,,,,,,,,,,,,,Acer Aspire Lite
B0D7PYTTGH,https://www.amazon.in/Acer-Celeron-Processor-LPDDR4X-A325-45/dp/B0D7PYTTGH/ref=sr_1_3?dib=eyJ2IjoiMSJ9.OEYfzYNd95GjvreCKceOJ45NuVSCPThbajjCbnE8d2PR5sHDumC2UUvei1Gf0tUYql2bPOEBI89QcuBbn2O4p4gZqX260L37uw-I2u4OiMjI_i4qmDuNV4N7P34r1vJmOuALodHVFDb8XDHMSPYAThjLN4wWaBN9SNAMod1gtNdQqNBzFDNMBO09-QzV8nTyT4NQi5UvslT7DrOqhfpF4LRQEMY5VoGAfEIGEokAA-lH79TFNUFc9_Hj6tZvz4SNfcgFbYFwes6u5h-uLWDZCu0RuwH6can-il1zG7-Y0C8.BUlfE9bB305UmQ_zeLF8x16caOZxC-tbIY9g1X7NsAQ&dib_tag=se&qid=1721801973&refinements=p_89%3AAcer&rnid=3837712031&s=computers&sr=1-3,"Acer Aspire 3 Laptop Intel Core Celeron N4500 Processor Laptop (8 GB LPDDR4X SDRAM/512 GB SSD/Win11 Home/38 Whr/HD Webcam) A325-45 with 39.63 cm (15.6"") HD Display, Pure Silver, 1.5 KG",,,," Processor : Whether you're at home, school, or work, get all the performance you need with the latest Intel Celeron N4500 Processor @ 1.10GHz ( 2 Cores, 4M Cache, up to 2.80 GHz); maintaining order and keeping your apps running consistently and smoothly. |  Performance : 8GB LPDDR4X RAM for full-power multitasking; 512GB SSD; Thisthin and light laptop offers a good experience for watching videos, browsing the web, remote work, or study from home. |  Display : 15.6-inch HD 1366 x 768 resolution display keeps images and videos stunning while the narrow border offers-up more viewable space. To protect user’s eyes from harmful blue light, it also includes Acer BlueLightShield. |  Wireless Connectivity : Dual band Wi-Fi 5 (802.11ac) provides fast internet access. For enhanced video calls this laptop also includes and optimized camera and microphones. |  Plenty of Ports : Flexible connectivity options through USB 3.0 ports. Users can also connect an external display through the HDMI port.",https://www.amazon.in/dp/B0D7PYTTGH,23499,https://m.media-amazon.com/images/I/61qlqvTsocL._SL1500_.jpg,9,"""https://m.media-amazon.com/images/I/61qlqvTsocL._SL1500_.jpg | https://m.media-amazon.com/images/I/71p+Rn+JgbL._SL1500_.jpg | https://m.media-amazon.com/images/I/81VaK2cK4gL._SL1500_.jpg | https://m.media-amazon.com/images/I/71W6EmfwI-L._SL1500_.jpg | https://m.media-amazon.com/images/I/71Mwxs8TX+L._SL1500_.jpg | https://m.media-amazon.com/images/I/71MllJzfDfL._SL1500_.jpg | https://m.media-amazon.com/images/I/71V25H7JYBL._SL1500_.jpg | https://m.media-amazon.com/images/I/71uCkKulN-L._SL1500_.jpg | https://m.media-amazon.com/images/I/71ttlQEQtXL._SL1500_.jpg""","Acer Aspire 3 Intel Core Celeron N4500 Processor Laptop (Windows 11 Home/ 8 GB/ 512 GB SSD) A324-45 with 35.56 cm (14"") TN HD Display, Pure Silver, 1.3 KG",https://store.acer.com/en-in/acer-aspire-3-intel-core-celeron-n4500-processor-laptop-windows-11-home-8-gb-512-gb-ssd-a324-45-with-35-56-cm-14-tn-hd-display-pure-silver-1-3-kg-un-342si-004,LED,38 Wh,Lithium Ion (Li-Ion),Yes,Supports Bluetooth 5.0,Pure Silver,22.8 cm,LCD,"35.6 cm (14"") Display with TN, HD 1366 x 768, Acer ComfyView LED-backlit TFT LCD, 16:9 aspect ratio, Ultra-slim design, Mercury free, environment friendly",,,"E-mail: ail.easycare@acer.com Contact number：1800-11-6677 (For Laptop & Tablet), 1800-11-4100 ( For Desktop, Monitor & All in One ) Support Timings – 9:00 AM to 6:00 PM ( Monday to Saturday, except public holidays )",E-mail: acerindia.enquiries@acer.com Contact number: 1860-120-2019,Intel®,Intel UHD Graphics,,Yes,,1.77 cm,,,84key Acer keyboard layout with international language support including indicators of CapsLock and F2/Microphone mute,"ACER INDIA (PRIVATE) LTD, R.S. no 38/2, Sederapet Village,Villianur Commune,Puducherry-605111",ACER INDIA PRIVATE LIMITED Embassy Heights 6th Floor No 13 Magrath Road Next to HOSMAT HospitalBangaloreINDIA 560025,8 GB LPDDR4X SDRAM,,Yes,,2.0,1.0,2,,Windows 11 Home,64-bit,,"1U (contains Laptop 1N, Power cord 1N, Adapter 1N, User Manual 1N)",Multi-gesture Touchpad,DC/ 24W AC adapter,,Intel Core Celeron N4500,,,Celeron,,"35.6 cm (14"")",,"512 GB, PCIe Gen3 8 Gb/s up to 4 lanes, NVMe Support up to 1 TB",Stereo,Yes,8 GB,"3 x USB 3.0 ports, 1 x Type-C port",512 GB,Yes,One-year Warranty,Yes,"Video conferencing  UFC with  T-Type HD camera, Compatible with Windows only",1.3 KG,35.74 cm,Yes,,,IEEE 802.11a/b/g/n/ac,,,,,,,,,,,,,,,,,"Acer Aspire 3 "
B0CLTW4D7T,https://www.amazon.in/Acer-i5-1235U-Windows-Graphics-AL15-52/dp/B0CLTW4D7T/ref=sr_1_4?dib=eyJ2IjoiMSJ9.OEYfzYNd95GjvreCKceOJ45NuVSCPThbajjCbnE8d2PR5sHDumC2UUvei1Gf0tUYql2bPOEBI89QcuBbn2O4p4gZqX260L37uw-I2u4OiMjI_i4qmDuNV4N7P34r1vJmOuALodHVFDb8XDHMSPYAThjLN4wWaBN9SNAMod1gtNdQqNBzFDNMBO09-QzV8nTyT4NQi5UvslT7DrOqhfpF4LRQEMY5VoGAfEIGEokAA-lH79TFNUFc9_Hj6tZvz4SNfcgFbYFwes6u5h-uLWDZCu0RuwH6can-il1zG7-Y0C8.BUlfE9bB305UmQ_zeLF8x16caOZxC-tbIY9g1X7NsAQ&dib_tag=se&qid=1721801973&refinements=p_89%3AAcer&rnid=3837712031&s=computers&sr=1-4,"Acer Aspire Lite 12th Gen Intel Core i5-1235U Thin and Light Laptop (Windows 11 Home/16GB RAM/512GB SSD/Intel Iris Xe Graphics) AL15-52, 39.62cm (15.6"") Full HD Display, Metal Body, Steel Gray, 1.6 KG",3.8,439.0,," Processor : Great performance meets long battery life with the Intel Core i5-1235U Processor - up to 4.40 GHz, 10 cores, 12 threads, 12 MB Intel Smart Cache |  Visibly Stunning: Experience sharp details and crisp colors on the 15.6"" Full HD display, 16:9 aspect ratio, ultra-slim design and narrow bezels. |  RAM : 16 GB DDR4 RAM, Storage : 512 GB SSD || Operating System : Windows 11 Home, Graphic : Intel Iris Xe Graphics |  Ports: one Type-C, two Type-A USB 2.0 port, and one Type-A USB 3.2 port. |  Keyboard: 100-/101-/104-key keyboard with independent numeric keypad, international language support",https://www.amazon.in/dp/B0CLTW4D7T,40999,https://m.media-amazon.com/images/I/71czGb00k5L._SL1500_.jpg,7,"""https://m.media-amazon.com/images/I/71czGb00k5L._SL1500_.jpg | https://m.media-amazon.com/images/I/91uEdp5TfjL._SL1500_.jpg | https://m.media-amazon.com/images/I/81m7ZPQ0aLL._SL1500_.jpg | https://m.media-amazon.com/images/I/715tDe1ADAL._SL1000_.jpg | https://m.media-amazon.com/images/I/71xcBBdAX9L._SL1500_.jpg | https://m.media-amazon.com/images/I/61Xkk+I8kGL._SL1000_.jpg | https://m.media-amazon.com/images/I/61zDpKrm9KL._SL1000_.jpg""","Acer Aspire Lite 12th Gen Intel Core i5-1235U Processor Laptop (Windows 11 Home/ 16 GB RAM/ 512 GB SSD/ Intel Graphics/ Microsoft Office) AL15-52 with 39.6 cm (15.6"") Full HD Display, Backlit Keyboard, Steel Gray, 1.59 KG",https://store.acer.com/en-in/acer-aspire-lite-12th-gen-intel-core-i5-1235u-processor-laptop-windows-11-home-16-gb-ram-512-gb-ssd-intel-graphics-microsoft-office-al15-52-with-39-6-cm-15-6-full-hd-display-backlit-keyboard-steel-gray-1-59-kg-un-33bsi-006,,36 Wh,Lithium Ion (Li-Ion),Yes,Supports Bluetooth 5.2,Steel Gray,23.93 cm,,"39.6 cm (15.6"") FHD 1920 x 1080, high-brightness TFT LCD",,,"E-mail: ail.easycare@acer.comContact number：1800-11-6677 (For Laptop & Tablet), 1800-11-4100 ( For Desktop, Monitor & All in One )Support Timings – 9:00 AM to 6:00 PM ( Monday to Saturday, except public holidays )",E-mail: acerindia.enquiries@acer.comContact number: 1860-120-2019,Intel®,Intel Integrated Graphics,Yes,Yes,,1.99 cm,,,"100-/101-/104-key keyboard with independent numeric keypad, international language support","Acer India (Private) Limited, RS No.38/2, Sedarpet Village, Villanur Commune, Poducherry - 605111.","ACER INDIA PRIVATE LIMITED Embassy Heights, 6th Floor, No. 13, Magrath Road, Next to HOSMAT Hospital, Bangalore, INDIA – 560025",,DDR4 SDRAM,,Yes,3.0,,2,,Windows 11 Home,64-bit,,"1U contains (Laptop 1N, Power cord 1N, Adapter 1N, User Manual 1N)","Multi-gesture touchpad, Built in Click pad with Microsoft PTP multi-gesture and scrolling function",45 W AC adapter,,Intel Core i5-1235U,,,Core™ i5,1920 x 1080,"39.6 cm (15.6"")",,"512 GB SSD, PCIe, NVMe",Stereo,Yes,16 GB,"1 x USB 3.2 Gen1 (Type A), 2 x USB 2.0 (Type A), 1 x USB 3.2 Gen2 (Type C) and 1 x DC-in jack",512 GB,Yes,One Year Warranty,Yes,"HD Webcam with 1280 x 720 resolution, 720p HD audio/video recording",1.59 KG,36.04 cm,Yes,,WIFI 5 + BT 5.2,,,,,,,,,,,,,,,,,,Acer Aspire Lite
B0D32SKB4C,https://www.amazon.in/Acer-Graphics-Win11Home-AL15G-52-39-62cm/dp/B0D32SKB4C/ref=sr_1_5?dib=eyJ2IjoiMSJ9.OEYfzYNd95GjvreCKceOJ45NuVSCPThbajjCbnE8d2PR5sHDumC2UUvei1Gf0tUYql2bPOEBI89QcuBbn2O4p4gZqX260L37uw-I2u4OiMjI_i4qmDuNV4N7P34r1vJmOuALodHVFDb8XDHMSPYAThjLN4wWaBN9SNAMod1gtNdQqNBzFDNMBO09-QzV8nTyT4NQi5UvslT7DrOqhfpF4LRQEMY5VoGAfEIGEokAA-lH79TFNUFc9_Hj6tZvz4SNfcgFbYFwes6u5h-uLWDZCu0RuwH6can-il1zG7-Y0C8.BUlfE9bB305UmQ_zeLF8x16caOZxC-tbIY9g1X7NsAQ&dib_tag=se&qid=1721801973&refinements=p_89%3AAcer&rnid=3837712031&s=computers&sr=1-5,"Acer ALG 12th Gen Intel Core i5 Gaming Laptop (16GB RAM/512GB SSD/4GB RTX 2050 Graphics/60Hz/Win11Home/Wifi 6) AL15G-52, 39.62cm (15.6 inch) FHD Display, Premium Metal Body, Steel Gray, 1.99KG",4.0,946.0,," Powerful Productivity: 12th Generation Intel Core i5-12450H Dual Core processor delivers unmatched speed and intelligence, enabling impressive creating, productivity, and gaming experiences. With Turbo Boost Technology, get up to 4.4GHz for your high-demand applications. Connectivity Technology: Wi-Fi, Bluetooth, HDMI |  Visibly Stunning: Experience sharp details and crisp colors on the 15.6"" Full HD display, 16:9 aspect ratio, ultra-slim design and narrow bezels. |  Internal Specifications: RAM - 16 GB of Dual-channel DDR4, 2 SODIMM modules; Storage - 512 GB SSD NVMe storage to store your files and media |  Ports: two USB 3.2 Type-C port, one USB 2.0 Type-A port and one USB 3.2 Type-A port. |  Keyboard: Multi languages Multi-Color illuminated full size keyboard with numeric pad",https://www.amazon.in/dp/B0D32SKB4C,51999,https://m.media-amazon.com/images/I/610pMwN1z6L._SL1080_.jpg,8,"""https://m.media-amazon.com/images/I/610pMwN1z6L._SL1080_.jpg | https://m.media-amazon.com/images/I/71pSySZUc6L._SL1500_.jpg | https://m.media-amazon.com/images/I/71uAFmjGeYL._SL1500_.jpg | https://m.media-amazon.com/images/I/71w+EvM-UEL._SL1500_.jpg | https://m.media-amazon.com/images/I/81WQuihDvuL._SL1500_.jpg | https://m.media-amazon.com/images/I/71TUDKLrpnL._SL1500_.jpg | https://m.media-amazon.com/images/I/71Y4gRZTvgL._SL1500_.jpg | https://m.media-amazon.com/images/I/71OJP+Xd1zL._SL1500_.jpg""","Acer ALG Gaming Laptop Intel Core i5-12450H Processor (Windows 11 Home/ 16 GB/ 512 GB SSD/NVIDIA GeForce RTX 2050/60 Hz) AL15G-52 with 39.6 cm (15.6"") Full HD, Steel Gray, 1.99 KG",https://store.acer.com/en-in/acer-alg-gaming-laptop-intel-core-i5-12450h-processor-windows-11-home-16-gb-512-gb-ssd-nvidia-geforce-rtx-2050-60-hz-al15g-52-with-39-6-cm-15-6-full-hd-steel-gray-1-99-kg-un-34csi-002,,54 Wh,Lithium Ion (Li-Ion),Yes,Supports Bluetooth 5.1,Steel Gray,23.8 cm,,"39.6 cm (15.6"") Display with FHD 1920 x 1080, high-brightness 60Hz, 16:9 aspect ratio",,,"E-mail: ail.easycare@acer.com
Contact number：1800-11-6677 (For Laptop & Tablet), 1800-11-4100 ( For Desktop, Monitor & All in One )
Support Timings – 9:00 AM to 6:00 PM ( Monday to Saturday, except public holidays )","E-mail: acerindia.enquiries@acer.com
 Contact number: 1860-120-2019",NVIDIA®️,NVIDIA GeForce RTX 2050 - 4GB GDDR6 Video RAM,Yes,Yes,,2.27 cm,,,Multi languages Multi-Color illuminated full size keyboard with numeric pad,"Acer India (Private) Limited, RS No.38/2, Sedarpet Village, Villanur Commune, Poducherry - 605111.","ACER INDIA PRIVATE LIMITED Embassy Heights, 6th Floor, No. 13, Magrath Road, Next to HOSMAT Hospital, Bangalore, INDIA – 560025",Up to 64 GB,DDR4 SDRAM,Yes,Yes,4.0,1.0,2,,Windows 11 Home,64-bit,,"1U contains (Laptop 1N, Power cord 1N, Adapter 1N, User Manual 1N)",Built in Clickpad with Microsoft PTP multi-gesture and scrolling function,3-pin 120 W AC Adapter,,Intel Core i5-12450H,,,Core™ i5,1920 x 1080,"39.6 cm (15.6"")",,"512 GB, PCIe Gen4, 16 Gb/s, NVMe Support up to 2 TB with dual M.2 slot",Stereo,Yes,16 GB,"1 x USB 3.2 Type-A port, 1 x USB 2.0 Type-A port, 2 x USB 3.2 Type-C ports",512 GB,Yes,One Year Warranty,Yes,1.0 M HD Video camera,1.99 KG,35..95 cm,Yes,Intel,Intel Wireless Wi-Fi 6 AX201,IEEE 802.11a/b/g/n/acR2+ax,,,,,4GB,,,,,,,,,,,,Acer ALG Gaming Laptop
